FriendlyName,Operation,Description
(none),FilePreviewed,"User previews files on a SharePoint or OneDrive for Business site. These events typically occur in high volumes based on a single activity, such as viewing an image gallery."
Performed search query,SearchQueryPerformed,"User or system account performs a search in SharePoint or OneDrive for Business. Some common scenarios where a service account performs a search query include applying an eDiscovery holds and retention policy to sites and OneDrive accounts, and autoapplying retention or sensitivity labels to site content."
Recycled a file,FileRecycled,User moves a file into the SharePoint Recycle Bin.
Recycled a folder,FolderRecycled,User moves a folder into the SharePoint Recycle Bin.
Recycled all minor versions of file,FileVersionsAllMinorsRecycled,User deletes all minor versions from the version history of a file. The deleted versions are moved to the site's recycle bin.
Recycled all versions of file,FileVersionsAllRecycled,User deletes all versions from the version history of a file. The deleted versions are moved to the site's recycle bin.
Recycled version of file,FileVersionRecycled,User deletes a version from the version history of a file. The deleted version is moved to the site's recycle bin.
Renamed file,FileRenamed,User renames a document.
Restored file,FileRestored,User restores a document from the recycle bin of a site.
Uploaded file,FileUploaded,User uploads a document to a folder on a site.
Viewed page,PageViewed,"User views a page on a site. This doesn't include using a Web browser to view files located in a document library. Once a user views a page, the PageViewed event isn't logged again for the same user for same page for the next five minutes."
(none),PageViewedExtended,"This is related to the ""Viewed page"" (PageViewed) activity. A PageViewedExtended event is logged when the same person continually views a web page for an extended period (up to 3 hours).  The purpose of logging PageViewedExtended events is to reduce the number of PageViewed events that are logged when a page is continually viewed. This helps reduce the noise of multiple PageViewed records for what is essentially the same user activity, and lets you focus on the initial (and more important) PageViewed event."
View signaled by client,ClientViewSignaled,"A user's client (such as website or mobile app) has signaled that the indicated page has been viewed by the user. This activity is often logged following a PagePrefetched event for a page. NOTE: Because ClientViewSignaled events are signaled by the client, rather than the server, it's possible the event may not be logged by the server and therefore may not appear in the audit log. It's also possible that information in the audit record may not be trustworthy. However, because the user's identity is validated by the token used to create the signal, the user's identity listed in the corresponding audit record is accurate. The system waits five minutes before it logs the same event when the same user's client signals that the page has been viewed again by the user."
(none),PagePrefetched,"A user's client (such as website or mobile app) has requested the indicated page to help improve performance if the user browses to it. This event is logged to indicate that the page content has been served to the user's client. This event isn't a definitive indication that the user navigated to the page.  When the page content is rendered by the client (as per the user's request) a ClientViewSignaled event should be generated. Not all clients support indicating a prefetch, and therefore some prefetched activities might instead be logged as PageViewed events."
Copied folder,FolderCopied,User copies a folder from a site to another location in SharePoint or OneDrive for Business.
Created folder,FolderCreated,User creates a folder on a site.
Deleted folder,FolderDeleted,User deletes a folder from a site.
Deleted folder from recycle bin,FolderDeletedFirstStageRecycleBin,User deletes a folder from the recycle bin on a site.
Deleted folder from second-stage recycle bin,FolderDeletedSecondStageRecycleBin,User deletes a folder from the second-stage recycle bin on a site.
Modified folder,FolderModified,"User modifies a folder on a site. This includes changing the folder metadata, such as changing tags and properties."
Moved folder,FolderMoved,User moves a folder to a different location on a site.
Renamed folder,FolderRenamed,User renames a folder on a site.
Restored folder,FolderRestored,User restores a deleted folder from the recycle bin on a site.
Changed AppBypassInformationBarrier setting for the tenant,AppBypassInformationBarrier,A SharePoint or global administrator has changed apps access for SharePoint sites.
Applied information barrier mode to site,SiteIBModeSet,A SharePoint or global administrator has applied a mode to the site.
Applied segments to site,SiteIBSegmentsSet,"A SharePoint, global administrator, or site owner added one or more information barriers segments to a site."
Changed information barrier mode of site,SiteIBModeChanged,A SharePoint or global administrator has updated the mode of the site.
Changed segments of site,SiteIBSegmentsChanged,A SharePoint or global administrator changed one or more information barriers segments for a site.
Disabled information barriers for SharePoint and OneDrive,SPOIBIsDisabled,A SharePoint or global administrator has disabled information barriers for SharePoint and OneDrive in the organization.
Enabled information barriers for SharePoint and OneDrive,SPOIBIsEnabled,A SharePoint or global administrator has disabled information barriers for SharePoint and OneDrive in the organization.
Information barriers insights report completed,InformationBarriersInsightsReportCompleted,System completes build of the information barriers insights report.
Information barriers insights report OneDrive section queried,InformationBarriersInsightsReportOneDriveSectionQueried,An administrator queries the information barriers insights report for OneDrive accounts.
Information barriers insights report scheduled,InformationBarriersInsightsReportSchedule,An administrator schedules the information barriers insights report.
Information barriers insights report SharePoint section queried,InformationBarriersInsightsReportSharePointSectionQueried,An administrator queries the information barriers insights report for Sharepoint sites.
Removed segment from site,SiteIBSegmentsRemoved,A SharePoint or global administrator removed one or more information barriers segments from a site.
Downloaded offboarding package,DownloadOffboardingPkg,Downloaded the package used to remove devices from Defender for Endpoint.
Downloaded onboarding package,DownloadOnboardingPkg,Downloaded the package used to onboard devices to Defender for Endpoint.
Changed data retention,ChangeDataRetention,Edited the data retention settings for Defender for Endpoint.
Set advanced features,SetAdvancedFeatures,"Changed advanced features in Defender for Endpoint, enabling more precise controls during an incident. Only settings for advanced features that are generally available are logged in the Microsoft 365 audit log."
Added indicator,AddIndicator,Created a new Indicator of compromise you can use to track attacks and events.
Edited indicator,EditIndicator,Edited an Indicator of compromise.
Deleted indicator,DeleteIndicator,Removed an Indicator of compromise.
Collected investigation package,CollectInvestigationPackage,Collected information about a device that's used to understand attack tools and techniques.
Ran Antivirus scan,RunAntiVirusScan,Ran Microsoft Defender Antivirus scan on a device.
Restricted app execution,RestrictAppExecution,Prevent a malicious app from running.
Removed app restrictions,RemoveAppRestrictions,Allow an app to run.
Isolated device,IsolateDevice,"Isolated a device from the network, helping prevent attacks from spreading."
Released from isolation,ReleaseFromIsolation,Added an isolated device back onto the network.
Stopped and quarantined file,StopAndQuarantineFile,Quarantined a suspicious file for further analysis.
Downloaded file,DownloadFile,Downloaded a suspicious file for further investigation.
Offboarded device,DeviceOffBoarding,Removed a device from Defender for Endpoint.
Ran Live response API,RunLiveResponseApi,"Opened a Live response session via an API call, opening a remote shell into a device."
Collected Logs,LogsCollection,Collected log information about Defender for Endpoint.
Ran get Live response file link,LiveResponseGetFile,"Opened a Live response session, opening a remote shell into a device."
Ran Live response session,RunLiveResponseSession,"Ran a Live response session, opening a remote shell into a device."
AddRole,Added role,Added new security role and permissions.
EditRole,Edited role,Edited security roles and permissions.
DeleteRole,Deleted role,Removed security roles and permissions.
Defender Experts analyst permission created,DefenderExpertsAnalystPermissionCreated,An administrator granted one or more role permissions to Defender Experts analysts to investigate incidents or remediate threats.
Defender Experts analyst permission modified,DefenderExpertsAnalystPermissionModified,An administrator modified role permissions for Defender Experts analysts to investigate incidents or remediate threats.
Updated entity tags,TaggingConfigurationUpdated,A tag was added or removed from an entity.
Added exclusions configuration,ExclusionConfigurationAdded,A global exclusion was added for an alert or for an entity.
Updated exclusions configuration,ExclusionConfigurationUpdated,A global exclusion was updated for an alert or for an entity.
Deleted exclusions configuration,ExclusionConfigurationDeleted,A global exclusion was deleted for an alert or for an entity.
Updated alert threshold configuration,WorkspaceAlertThresholdLevelUpdated,The alerts thresholds configuration was updated.
Downloaded security alert Excel,AlertExcelDownloaded,The detailed Excel file of an alert was downloaded.
Added remediation action,RemediationActionAdded,A remediation action was added to the queue.
Updated remediation action,RemediationActionUpdated,A remediation action was completed.
Updated sensor configuration,SensorConfigurationUpdated,A sensor's configuration was updated.
Added sensor,SensorCreated,A new sensor was added.
Removed sensor,SensorDeleted,A sensor was deleted.
Retrieved sensor deployment key,SensorDeploymentAccessKeyReceived,The sensors access key was retrieved.
Regenerated sensor deployment key,SensorDeploymentAccessKeyUpdated,The sensors access key was regenerated.
Downloaded Domain Controller coverage Excel,DomainControllerCoverageExcelDownloaded,The Domain Controller coverage Excel file was downloaded.
Updated directory services account configuration,DirectoryServicesAccountConfigurationUpdated,The Directory services accounts set was modified.
Updated remediation action configuration,RemediationActionConfigurationUpdated,The Manage action accounts set was modified.
Updated entity remediation configuration,EntityRemediatorConfigurationUpdated,The Manage action accounts mode was modified.
Updated health issue,MonitoringAlertUpdated,A health issue was modified.
Downloaded report,ReportDownloaded,A report was downloaded.
Updated reporter configuration,ReporterConfigurationUpdated,A report's scheduling was modified.
Updated syslog forwarding configuration,SyslogServiceConfigurationUpdated,The syslog forwarding configuration was modified.
Updated security notification configuration,NotificationConfigurationUpdated,The security alerts or health issues notifications configuration was modified.
Added alert notification recipient,AlertNotificationsRecipientAdded,A recipient was added to the security alerts notification configuration.
Deleted alert notification recipient,AlertNotificationsRecipientDeleted,A recipient was removed from the security alerts notification configuration.
Added health issues notification recipient,MonitoringAlertNotificationRecipientAdded,A recipient was added to the health issues notification configuration.
Deleted health issues notification recipient,MonitoringAlertNotificationRecipientDeleted,A recipient was removed from the heath issues notification configuration.
Updated VPN configuration,VpnConfigurationUpdated,The VPN (radius accounting) configuration was modified.
Updated Unified RBAC configuration,URbacAuthorizationStatusChanged,The Unified Role Based Access Control configuration was modified.
Created workspace,WorkspaceCreated,The workspace was created.
Deleted workspace,WorkspaceDeleted,The workspace was deleted.
Created custom detection rule,CreateCustomDetection,A new custom detection rule was created.
Edited custom detection rule,EditCustomDetection,A custom detection rule was modified.
Changed custom detection rule status,ChangeCustomDetectionRuleStatus,A custom detection rule was turned off or on.
Ran custom detection rule,RunCustomDetection,A custom detection rule was manually run.
Deleted custom detection rule,DeleteCustomDetection,A custom detection rule was removed.
Added comment to incident,AddCommentToIncident.,Added comment to incident.
Assigned user to incident,AssignUserToIncident,Assigned user to incident.
Unassigned user to incident,UnAssignUserFromIncident,Unassigned user to incident.
Updated incidents status,UpdateIncidentStatus,Updated incidents status.
Edit incident classification,EditIncidentClassification,Edit incident classification.
Added tags to incident,AddTagsToIncident,Added tags to incident.
Removed tags from incident,RemoveTagsFromIncident,Removed tags from incident.
Created suppression rule,CreateSuppressionRule,Created alert suppression rule.
Edited suppression rule,EditSuppressionRule,Deleted alert suppression rule.
Enabled suppression rule,EnableSuppressionRule,Enabled alert suppression rule.
Disabled suppression rule,DisableSuppressionRule,Disabled alert suppression rule.
Deleted suppression rule,DeleteSuppressionRule,Deleted alert suppression rule.
Added group,Add group.,A group was created.
Added member to group,Add member to group.,A member was added to a group.
Deleted group,Delete group.,A group was deleted.
Removed member from group,Remove member from group.,A member was removed from a group.
Updated group,Update group.,A property of a group was changed.
Created comment,CreateComment,Form owner adds comment or score to a quiz.
Created form,CreateForm,Form owner creates a new form. Property DataMode:string indicates the current form is set to sync with a new or existing Excel workbook if the property value equals DataSync. Property ExcelWorkbookLink:string indicates the associated Excel workbook ID of the current form.
Edited form,EditForm,"Form owner edits a form such as creating, removing, or editing a question. The property EditOperation:string indicates the edit operation name. The possible operations are:- CreateQuestion- CreateQuestionChoice - DeleteQuestion - DeleteQuestionChoice - DeleteFormImage - DeleteQuestionImage - UpdateQuestion - UpdateQuestionChoice - UploadFormImage/Bing/Onedrive - UploadQuestionImage - ChangeTheme FormImage includes any place within Forms that user can upload an image, such as in a query or as a background theme."
Moved form,MoveForm,Form owner moves a form. Property DestinationUserId:string indicates the user ID of the person who moved the form. Property NewFormId:string is the new ID for the newly copied form. Property IsDelegateAccess:boolean indicates the current form move action is performed through the admin delegate page.
Deleted form,DeleteForm,Form owner deletes a form. This includes SoftDelete (delete option used and form moved to recycle bin) and HardDelete (Recycle bin is emptied).
Viewed form (design time),ViewForm,Form owner opens an existing form for editing. Property AccessDenied:boolean indicates access of current form is denied due to permission check. Property FromSummaryLink:boolean indicates current request comes from the summary link page.
Previewed form,PreviewForm,Form owner previews a form using the Preview function.
Exported form,ExportForm,Form owner exports results to Excel. Property ExportFormat:string indicates if the Excel file is Download or Online.
Allowed share form for copy,AllowShareFormForCopy,Form owner creates a template link to share the form with other users. This event is logged when the form owner selects to generate template URL.
Disallowed share form for copy,DisallowShareFormForCopy,Form owner deletes template link.
Added form coauthor,AddFormCoauthor,A user uses a collaboration link to help design for/view responses. This event is logged when a user uses a collab URL (not when collab URL is first generated).
Removed form coauthor,RemoveFormCoauthor,Form owner deletes a collaboration link.
Viewed response page,ViewRuntimeForm,User has opened a response page to view. This event is logged regardless of whether the user submits a response or not.
Created response,CreateResponse,"Similar to receiving a new response. A user has submitted a response to a form. Property ResponseId:string and Property ResponderId:string indicates which result is being viewed. For an anonymous responder, the ResponderId property is null."
Updated response,UpdateResponse,"Form owner has updated a comment or score on a quiz. Property ResponseId:string and Property ResponderId:string indicates which result is being viewed. For an anonymous responder, the ResponderId property is null."
Deleted all responses,DeleteAllResponses,Form owner deletes all response data.
Deleted Response,DeleteResponse,Form owner deletes one response. Property ResponseId:string indicates the response being deleted.
Viewed responses,ViewResponses,Form owner views the aggregated list of responses. Property ViewType:string indicates whether form owner is viewing Detail or Aggregate
Viewed response,ViewResponse,"Form owner views a particular response. Property ResponseId:string and Property ResponderId:string indicates which result is being viewed. For an anonymous responder, the ResponderId property is null."
Created summary link,GetSummaryLink,Form owner creates summary results link to share results.
Deleted summary link,DeleteSummaryLink,Form owner deletes summary results link.Updated form phishing status
Updated user phishing status,UpdateUserPhishingStatus,"This event is logged whenever the value for the user security status was changed. The value of the user status in the audit record is Confirmed as Phisher when the user created a phishing form that was taken down by the Microsoft Online safety team. If an admin unblocks the user, the value of the user's status is set to Reset as Normal User."
Sent Forms Pro invitation,ProInvitation,User selects to activate a Pro trial.
Updated form setting,UpdateFormSetting,Form owner updates one or multiple form settings. Property FormSettingName:string indicates updated sensitive settings' name. Property NewFormSettings:string indicates updated settings' name and new value. Property thankYouMessageContainsLink:boolean indicates updated thank-you message contains a URL link.
Updated user setting,UpdateUserSetting,Form owner updates a user setting. Property UserSettingName:string indicates the setting's name and new value
Listed forms,ListForms,"Form owner is viewing a list of forms. Property ViewType:string indicates which view the form owner is looking at: All Forms, Shared with Me, or Group Forms"
Submitted response,SubmitResponse,A user submits a response to a form. Property IsInternalForm:boolean indicates if the responder is within the same organization as the form owner.
Enabled anyone can respond setting,AllowAnonymousResponse,Form owner turns on the setting allowing any one to respond to the form.
Disabled anyone can respond setting,DisallowAnonymousResponse,Form owner turns off the setting allowing any one to respond to the form.
Enabled specific people can respond setting,EnableSpecificResponse,Form owner turns on the setting allowing only specific people or specific groups in the current organization to respond to the form.
Disabled specific people can respond setting,DisableSpecificResponse,Form owner turns off the setting allowing only specific people or specific groups in the current organization to respond to the form.
Added specific responder,AddSpecificResponder,Form owner adds a new user or group to the specific responders list.
Removed specific responder,RemoveSpecificResponder,Form owner removes a user or group from the specific responders list.
Disabled collaboration,DisableCollaboration,Form owner turns off the setting of collaboration on the form.
Enabled Office 365 work or school account collaboration,EnableWorkOrSchoolCollaboration,Form owner turns on the setting allowing users with a Microsoft 365 work or school account to view and edit the form.
Enabled people in my organization collaboration,EnableSameOrgCollaboration,Form owner turns on the setting allowing users in the current organization to view and edit the form.
Enabled specific people collaboration,EnableSpecificCollaboaration,Form owner turns on the setting allowing only specific people or specific groups in the current organization to view and edit the form.
Connected to Excel workbook,ConnectToExcelWorkbook,Connected the form to an Excel workbook. Property ExcelWorkbookLink:string indicates the associated Excel workbook ID of the current form.
Created a collection,CollectionCreated,Form owner created a collection.
Updated a collection,CollectionUpdated,Form owner updated a collection property.
Deleted collection from the Recycle Bin,CollectionHardDeleted,Form owner hard-deleted a collection from the Recycle Bin.
Moved collection to the Recycle Bin,CollectionSoftDeleted,Form owner moved a collection to the Recycle Bin.
Renamed a collection,CollectionRenamed,Form owner changed the name of a collection.
Moved a form into collection,MovedFormIntoCollection,Form owner moved a form into a collection.
Moved a form out of collection,MovedFormOutofCollection,Form owner moved a form out of a collection.
Approved or denied an app,ConsentModificationRequest,A user performed a consent modification request.
Extraction ran,DataAccessRequestOperation,A user performed an extraction. Partner datasets and ISV runs are excluded.
Read a plan,PlanRead,"A plan is read by a user or an app. If the read operation is a ResultStatus.Failure or ResultStatus.AuthorizationFailure, ContainerType indicates ContainerType.Invalid and ContainerId indicates null."
Created a plan,PlanCreated,"A plan is created by a user or an app. If the create operation is a ResultStatus.Failure or ResultStatus.AuthorizationFailure, ObjectId indicates null, ContainerType indicates ContainerType.Invalid and ContainerId indicates null."
Modified a plan,PlanModified,A plan is modified by a user or an app.
Deleted a plan,PlanDeleted,A plan is deleted by a user or an app.
Copied a plan,PlanCopied,"A plan is copied by a user or an app. If the copy operation is a ResultStatus.Failure or ResultStatus.Failure, newPlanId indicates null, newContainerType indicates ContainerType.Invalid, and newContainerId indicates null."
Read a task,TaskRead,"A task is read by a user or an app. If the read operation is a ResultStatus.Failure or ResultStatus.AuthorizationFailure, PlanId indicates null."
Created a task,TaskCreated,"A task is created by a user or an app. If the create operation is a ResultStatus.Failure or ResultStatus.AuthorizationFailure, ObjectId indicates null and PlanId indicates null."
Modified a task,TaskModified,A task is modified by a user or an app.
Deleted a task,TaskDeleted,A task is deleted by a user or an app.
Assigned a task,TaskAssigned,A task's assignee is modified by a user or an app. This can be an unassigned task getting assigned or an assigned task has a new assignee.
Completed a task,TaskCompleted,A task is marked completed by a user or an app.
Created a roster,RosterCreated,"A roster is created by a user or an app. If the create operation is a ResultStatus.Failure or ResultStatus.AuthorizationFailure, ObjectId indicates null, MemberIds indicates an empty string."
Deleted a roster,RosterDeleted,A roster is deleted by a user or an app.
Added a member(s) to a roster,RosterMemberAdded,"A member(s) is added to a roster. If the add operation is a ResultStatus.Failure or ResultStatus.AuthorizationFailure, MemberIds indicates the list of member IDs attempted."
Removed a member(s) to a roster,RosterMemberDeleted,"A member(s) is removed from a roster. If the remove operation is a ResultStatus.Failure or ResultStatus.AuthorizationFailure, MemberIds indicates the list of member IDs attempted."
Read a list of plans,PlanListRead,"A list of plans is queried by a user or an app. If the query operation is a ResultStatus.Failure or ResultStatus.AuthorizationFailure, PlanList indicates an empty string."
Read a list of tasks,TaskListRead,"A list of tasks is queried by a user or an app. If the query operation is a ResultStatus.Failure or ResultStatus.AuthorizationFailure, TaskList indicates an empty string."
Updated tenant settings,TenantSettingsUpdated,"Tenant settings are updated by a tenant admin. If the update operation is a ResultStatus.Failure or ResultStatus.AuthorizationFailure, ObjectId indicates the original settings, and TenantSettings indicates the tenant settings attempted."
Updated a roster's sensitivity label,RosterSensitivityLabelUpdated,A user or an app updates a roster's sensitivity label.
Created project,ProjectCreated,A project is created by a user or app.
Created roadmap,RoadmapCreated,A roadmap or portfolio is created by a user or app.
Created roadmap item,RoadmapItemCreated,A roadmap or portfolio item is created by a user or app.
